{
  "$schema": "../schemas/body_zone.schema.json",
  "id": "left_leg",
  "name": "Left Leg",
  "hit_weight": 0.125,
  "wound_thresholds": { "graze": 2, "wound": 5, "severe": 10, "lethal": 16 },
  "critical_effects": [
    { "at_severity": "wound",  "effect": "speed_reduced" },
    { "at_severity": "severe", "effect": "mobility_halved" },
    { "at_severity": "lethal", "effect": "limb_lost" }
  ],
  "pain_multiplier": 0.9,
  "blocks_reach_if_wounded": false
}
